{
    "$schema": "trainer.schema.json",
    "name": "Ryder",
    "class": "TRAINER_CLASS_FISHERMAN",
    "battle_style": "BTL_STYLE_SINGLE",
    "items": [],
    "ai_flags": [ "AI_FLAG_BASIC" ],
    "heals": false,
    "money": 8,
    "reward": "ITEM_NONE",
    "party": [
        {
            "species": "SPECIES_BARBOACH",
            "form": 0,
            "level": 60,
            "difficulty": 0,
            "gender": 0,
            "ability": 0
        },
        {
            "species": "SPECIES_STUNFISK",
            "form": 0,
            "level": 60,
            "difficulty": 0,
            "gender": 0,
            "ability": 0
        },
        {
            "species": "SPECIES_WHISCASH",
            "form": 0,
            "level": 60,
            "difficulty": 0,
            "gender": 0,
            "ability": 0
        }
    ],
    "messages": [
        {
            "type": "TRMSG_START",
            "text": "Real Fishermen are impatient!\nSo we must battle immediately!{be01}"
        },
        {
            "type": "TRMSG_LOSE",
            "text": "I lost!\nIt's the end!!"
        },
        {
            "type": 2,
            "text": "How do I know that real Fishermen\nare so impatient?{be01}\nBecause we change places frantically\nif we cannot catch Pokémon!"
        }
    ]
}
