{
    "$schema": "trainer.schema.json",
    "name": "Stephen",
    "class": "TRAINER_CLASS_HIKER",
    "battle_style": "BTL_STYLE_SINGLE",
    "items": [],
    "ai_flags": [ "AI_FLAG_BASIC" ],
    "heals": false,
    "money": 8,
    "reward": "ITEM_NONE",
    "party": [
        {
            "species": "SPECIES_HIPPOPOTAS",
            "form": 0,
            "level": 64,
            "difficulty": 0,
            "gender": 0,
            "ability": 0
        },
        {
            "species": "SPECIES_CRUSTLE",
            "form": 0,
            "level": 64,
            "difficulty": 0,
            "gender": 0,
            "ability": 0
        },
        {
            "species": "SPECIES_HIPPOWDON",
            "form": 0,
            "level": 64,
            "difficulty": 0,
            "gender": 0,
            "ability": 0
        }
    ],
    "messages": [
        {
            "type": 0,
            "text": "When I look down from a high place,\nI feel very good!{be01}\nPokémon battles are the same!\nI will fight looking down from the heights!{be01}"
        },
        {
            "type": 1,
            "text": "You're great!\nI can't help but look up to you!"
        },
        {
            "type": 2,
            "text": "We climb mountains because,\nno matter how hard it is,{be00}\nthe higher we climb,{be00}\nthe closer we get to the sky!"
        }
    ]
}
