{
    "$schema": "trainer.schema.json",
    "name": "Portia",
    "class": "TRAINER_CLASS_VETERAN_F",
    "battle_style": "BTL_STYLE_SINGLE",
    "items": [],
    "ai_flags": [ "AI_FLAG_BASIC", "AI_FLAG_EVAL_ATTACK", "AI_FLAG_EXPERT" ],
    "heals": false,
    "money": 20,
    "reward": "ITEM_NONE",
    "party": [
        {
            "species": "SPECIES_ZEBSTRIKA",
            "form": 0,
            "level": 54,
            "difficulty": 150,
            "gender": 0,
            "ability": 1,
            "moves": [ "MOVE_DISCHARGE", "MOVE_FLAME_CHARGE", "MOVE_STOMP", "MOVE_PURSUIT" ]
        },
        {
            "species": "SPECIES_SAWK",
            "form": 0,
            "level": 54,
            "difficulty": 150,
            "gender": 0,
            "ability": 1,
            "moves": [ "MOVE_BRICK_BREAK", "MOVE_ROCK_TOMB", "MOVE_RETALIATE", "MOVE_BULK_UP" ]
        },
        {
            "species": "SPECIES_STARMIE",
            "form": 0,
            "level": 54,
            "difficulty": 150,
            "gender": 0,
            "ability": 2,
            "moves": [ "MOVE_SURF", "MOVE_PSYSHOCK", "MOVE_FLASH_CANNON", "MOVE_GRASS_KNOT" ]
        }
    ],
    "messages": [
        {
            "type": "TRMSG_START",
            "text": "Are you sure? I'm strong, you know.\nYou still want to take me on?{be01}"
        },
        {
            "type": "TRMSG_LOSE",
            "text": "Yes, I'm sure... I'm weak, you know.\nWhy did you want to take me on?"
        },
        {
            "type": 2,
            "text": "Not wanting to admit my own limits,\nI am continuing to battle on...{be00}\nThat's right! At least I'm persistent!"
        }
    ]
}
