{
    "$schema": "trainer.schema.json",
    "name": "Autumn",
    "class": "TRAINER_CLASS_NURSERY_AIDE",
    "battle_style": "BTL_STYLE_SINGLE",
    "items": [],
    "ai_flags": [ "AI_FLAG_BASIC" ],
    "heals": false,
    "money": 10,
    "reward": "ITEM_NONE",
    "party": [
        {
            "species": "SPECIES_JIGGLYPUFF",
            "form": 0,
            "level": 61,
            "difficulty": 0,
            "gender": 0,
            "ability": 0
        },
        {
            "species": "SPECIES_PURUGLY",
            "form": 0,
            "level": 61,
            "difficulty": 0,
            "gender": 0,
            "ability": 0
        },
        {
            "species": "SPECIES_LICKITUNG",
            "form": 0,
            "level": 61,
            "difficulty": 0,
            "gender": 0,
            "ability": 0
        }
    ],
    "messages": [
        {
            "type": "TRMSG_START",
            "text": "I feel invincible because I am surrounded\nby the smiles of children and Pokémon!{be01}"
        },
        {
            "type": "TRMSG_LOSE",
            "text": "Wow! Great, great!\nYou are very strong!"
        },
        {
            "type": 2,
            "text": "Speak while making eye contact, and\nexpress your feelings to each other...{be00}\nIt's the same for people and Pokémon."
        }
    ]
}
