{
    "$schema": "trainer.schema.json",
    "name": "Benga",
    "class": "TRAINER_CLASS_BOSS_TRAINER_BENGA",
    "battle_style": "BTL_STYLE_SINGLE",
    "items": [],
    "ai_flags": [ "AI_FLAG_BASIC", "AI_FLAG_EVAL_ATTACK", "AI_FLAG_EXPERT" ],
    "heals": false,
    "money": 50,
    "reward": "ITEM_NONE",
    "party": [
        {
            "species": "SPECIES_LATIAS",
            "form": 0,
            "level": 80,
            "difficulty": 0,
            "gender": 0,
            "ability": 0,
            "item": "ITEM_WHITE_HERB",
            "moves": [ "MOVE_DRACO_METEOR", "MOVE_PSYCHIC", "MOVE_ICY_WIND", "MOVE_THUNDERBOLT" ]
        },
        {
            "species": "SPECIES_DRAGONITE",
            "form": 0,
            "level": 80,
            "difficulty": 0,
            "gender": 0,
            "ability": 0,
            "item": "ITEM_LIFE_ORB",
            "moves": [ "MOVE_OUTRAGE", "MOVE_FOCUS_BLAST", "MOVE_FIRE_BLAST", "MOVE_DRAGON_DANCE" ]
        },
        {
            "species": "SPECIES_VOLCARONA",
            "form": 0,
            "level": 80,
            "difficulty": 0,
            "gender": 0,
            "ability": 0,
            "item": "ITEM_FOCUS_SASH",
            "moves": [ "MOVE_FIRE_BLAST", "MOVE_BUG_BUZZ", "MOVE_PSYCHIC", "MOVE_QUIVER_DANCE" ]
        }
    ],
    "messages": []
}
