{
    "$schema": "trainer.schema.json",
    "name": "Grunt",
    "class": "TRAINER_CLASS_TEAM_PLASMA_GRUNT_F",
    "battle_style": "BTL_STYLE_SINGLE",
    "items": [],
    "ai_flags": [ "AI_FLAG_BASIC" ],
    "heals": false,
    "money": 10,
    "reward": "ITEM_NONE",
    "party": [
        {
            "species": "SPECIES_PURRLOIN",
            "form": 0,
            "level": 14,
            "difficulty": 0,
            "gender": 0,
            "ability": 0
        }
    ],
    "messages": [
        {
            "type": 1,
            "text": "Plasmaaaa!\nWhat a pesky little kid!"
        }
    ]
}
