{
    "$schema": "trainer.schema.json",
    "name": "Caitlin",
    "class": "TRAINER_CLASS_ELITE_FOUR_CAITLIN",
    "battle_style": "BTL_STYLE_SINGLE",
    "items": [ "ITEM_FULL_RESTORE" ],
    "ai_flags": [ "AI_FLAG_BASIC", "AI_FLAG_EVAL_ATTACK", "AI_FLAG_EXPERT" ],
    "heals": false,
    "money": 30,
    "reward": "ITEM_NONE",
    "party": [
        {
            "species": "SPECIES_MUSHARNA",
            "form": 0,
            "level": 56,
            "difficulty": 200,
            "gender": 0,
            "ability": 2,
            "item": "ITEM_NONE",
            "moves": [ "MOVE_CHARGE_BEAM", "MOVE_DREAM_EATER", "MOVE_YAWN", "MOVE_REFLECT" ]
        },
        {
            "species": "SPECIES_REUNICLUS",
            "form": 0,
            "level": 56,
            "difficulty": 200,
            "gender": 0,
            "ability": 2,
            "item": "ITEM_NONE",
            "moves": [ "MOVE_PSYCHIC", "MOVE_ENERGY_BALL", "MOVE_FOCUS_BLAST", "MOVE_RECOVER" ]
        },
        {
            "species": "SPECIES_SIGILYPH",
            "form": 0,
            "level": 56,
            "difficulty": 200,
            "gender": 0,
            "ability": 1,
            "item": "ITEM_NONE",
            "moves": [ "MOVE_PSYCHIC", "MOVE_SHADOW_BALL", "MOVE_ICE_BEAM", "MOVE_AIR_SLASH" ]
        },
        {
            "species": "SPECIES_GOTHITELLE",
            "form": 0,
            "level": 58,
            "difficulty": 250,
            "gender": 0,
            "ability": 1,
            "item": "ITEM_SITRUS_BERRY",
            "moves": [ "MOVE_PSYCHIC", "MOVE_SHADOW_BALL", "MOVE_THUNDERBOLT", "MOVE_CALM_MIND" ]
        }
    ],
    "messages": [
        {
            "type": 17,
            "text": "I have a feeling this battle will give my\nPokémon a chance to go all out!"
        },
        {
            "type": 19,
            "text": "I can't believe it's come to this!\nI must have gotten complacent."
        },
        {
            "type": 20,
            "text": "Ohhh, that's it! I'll go all out if it'll get\nme a win!"
        },
        {
            "type": 1,
            "text": "You and your Pokémon are\nboth excellent and elegant.{be01}\nTo have been able to battle against\nsuch a splendid team...{be01}\nMy Pokémon and I learned a lot!\nI offer you my thanks."
        }
    ]
}
